{
  "bodyTypeName": "male",
  "url": "https://sanderfrenken.github.io/Universal-LPC-Spritesheet-Character-Generator/#?body=Body_color_light&head=Human_male_light&sex=male&shadow=Shadow_shadow&hair=Braid_dark_brown&beard=Beard_brown&shoulders=none&apron=Apron_walnut&legs=Pants_blue&shoes=Shoes_charcoal&weapon=Rod_rod&clothes=Longsleeve_black&shield=none&weapon_magic_crystal=Crystal_blue",
  "spritesheets": "https://sanderfrenken.github.io/Universal-LPC-Spritesheet-Character-Generator/spritesheets/",
  "version": 1,
  "datetime": "10/01/2024, 22:19:17",
  "credits": "Authors: drjamgo@hotmail.com, bluecarrot16, Benjamin K. Smith (BenCreating), Evert, Eliza Wyatt (ElizaWy), TheraHedwig, MuffinElZangano, Durrani, Johannes Sj?lund (wulax), Stephen Challener (Redshrike), David Conway Jr. (JaidynReiman), Carlo Enrico Victoria (Nemisys), Nila122, ElizaWy, Johannes Sjölund (wulax), Joe White, Matthew Krohn (makrohn), Pierre Vigier, Tuomo Untinen, and Inboxninja\n\n- shadow/adult/shadow.png: by drjamgo@hotmail.com. License(s): CC0. \n    - https://opengameart.org/content/shadow-for-lpc-sprite\n\n- body/bodies/male/universal/light.png: by bluecarrot16, Benjamin K. Smith (BenCreating), Evert, Eliza Wyatt (ElizaWy), TheraHedwig, MuffinElZangano, Durrani, Johannes Sj?lund (wulax), Stephen Challener (Redshrike). License(s): CC-BY-SA 3.0, GPL 3.0. \n    - https://opengameart.org/content/liberated-pixel-cup-lpc-base-assets-sprites-map-tiles\n    - https://opengameart.org/content/lpc-medieval-fantasy-character-sprites\n    - https://opengameart.org/content/lpc-male-jumping-animation-by-durrani\n    - https://opengameart.org/content/lpc-runcycle-and-diagonal-walkcycle\n    - https://opengameart.org/content/lpc-revised-character-basics\n\n- head/heads/human_male/universal/light.png: by bluecarrot16, Benjamin K. Smith (BenCreating), Stephen Challener (Redshrike). License(s): OGA-BY 3.0, CC-BY-SA 3.0, GPL 3.0. \n    - https://opengameart.org/content/liberated-pixel-cup-lpc-base-assets-sprites-map-tiles\n    - https://opengameart.org/content/lpc-character-bases\n\n- beards/beard/male/brown.png: by David Conway Jr. (JaidynReiman), Carlo Enrico Victoria (Nemisys). License(s): CC-BY-SA 3.0, GPL 3.0. \n    - https://opengameart.org/content/lpc-brunet-mustache\n\n- hair/braid/male/dark_brown.png: by Nila122, ElizaWy. License(s): CC-BY-SA 3.0, GPL 3.0, GPL 2.0. \n    - https://opengameart.org/content/3-hairs-for-lpc\n    - https://opengameart.org/content/lpc-hair\n\n- torso/clothes/longsleeve/male/black.png: by David Conway Jr. (JaidynReiman), Johannes Sjölund (wulax). License(s): CC-BY-SA 3.0, GPL 3.0. \n    - https://opengameart.org/content/lpc-medieval-fantasy-character-sprites\n    - http://opengameart.org/content/lpc-clothing-updates\n\n- torso/aprons/apron/male/walnut.png: by Nila122. License(s): CC-BY-SA 3.0, GPL 2.0, GPL 3.0. \n    - https://opengameart.org/content/lpc-aprons\n\n- legs/pants/male/blue.png: by bluecarrot16, David Conway Jr. (JaidynReiman), Joe White, Matthew Krohn (makrohn), Johannes Sjölund (wulax). License(s): CC-BY-SA 3.0, GPL 3.0. \n    - https://opengameart.org/content/liberated-pixel-cup-lpc-base-assets-sprites-map-tiles\n    - https://opengameart.org/content/lpc-medieval-fantasy-character-sprites\n\n- feet/shoes/male/charcoal.png: by bluecarrot16, Johannes Sjölund (wulax). License(s): CC-BY-SA 3.0, GPL 3.0. \n    - https://opengameart.org/content/lpc-medieval-fantasy-character-sprites\n    - http://opengameart.org/content/lpc-clothing-updates\n\n- tools/rod/background/rod.png: by bluecarrot16, Pierre Vigier, Tuomo Untinen, Johannes Sjölund (wulax), and Inboxninja. License(s): CC-BY-SA 3.0. \n    - https://opengameart.org/content/lpc-hand-tools\n\n- tools/rod/foreground/rod.png: by bluecarrot16, Pierre Vigier, Tuomo Untinen, Johannes Sjölund (wulax), and Inboxninja. License(s): CC-BY-SA 3.0. \n    - https://opengameart.org/content/lpc-hand-tools\n\n- weapon/magic/crystal/blue.png: by bluecarrot16. License(s): OGA-BY 3.0+, GPL 3.0, CC-BY 4.0. \n    - https://opengameart.org/content/lpc-more-weapons\n\n- weapon/magic/crystal/universal_behind/blue.png: by bluecarrot16. License(s): OGA-BY 3.0+, GPL 3.0, CC-BY 4.0. \n    - https://opengameart.org/content/lpc-more-weapons\n\n- weapon/magic/crystal/attack_thrust/blue.png: by bluecarrot16. License(s): OGA-BY 3.0+, GPL 3.0, CC-BY 4.0. \n    - https://opengameart.org/content/lpc-more-weapons\n\n- weapon/magic/crystal/attack_thrust/background/blue.png: by bluecarrot16. License(s): OGA-BY 3.0+, GPL 3.0, CC-BY 4.0. \n    - https://opengameart.org/content/lpc-more-weapons",
  "layers": [
    {
      "fileName": "weapon/magic/crystal/attack_thrust/background/blue.png",
      "zPos": -1,
      "custom_animation": "thrust_oversize",
      "parentName": "weapon_magic_crystal",
      "name": "Crystal",
      "variant": "blue"
    },
    {
      "fileName": "shadow/adult/shadow.png",
      "zPos": 0,
      "parentName": "shadow",
      "name": "Shadow",
      "variant": "shadow"
    },
    {
      "fileName": "tools/rod/background/rod.png",
      "zPos": 9,
      "custom_animation": "tool_rod",
      "parentName": "weapon",
      "name": "Rod",
      "variant": "rod"
    },
    {
      "fileName": "weapon/magic/crystal/universal_behind/blue.png",
      "zPos": 9,
      "parentName": "weapon_magic_crystal",
      "name": "Crystal",
      "variant": "blue"
    },
    {
      "fileName": "body/bodies/male/universal/light.png",
      "zPos": 10,
      "parentName": "body",
      "name": "Body color",
      "variant": "light"
    },
    {
      "fileName": "feet/shoes/male/charcoal.png",
      "zPos": 15,
      "parentName": "shoes",
      "name": "Shoes",
      "variant": "charcoal"
    },
    {
      "fileName": "legs/pants/male/blue.png",
      "zPos": 20,
      "parentName": "legs",
      "name": "Pants",
      "variant": "blue"
    },
    {
      "fileName": "torso/clothes/longsleeve/male/black.png",
      "zPos": 35,
      "parentName": "clothes",
      "name": "Longsleeve",
      "variant": "black"
    },
    {
      "fileName": "torso/aprons/apron/male/walnut.png",
      "zPos": 40,
      "parentName": "apron",
      "name": "Apron",
      "variant": "walnut"
    },
    {
      "fileName": "head/heads/human_male/universal/light.png",
      "zPos": 100,
      "parentName": "head",
      "name": "Human male",
      "variant": "light"
    },
    {
      "fileName": "beards/beard/male/brown.png",
      "zPos": 110,
      "parentName": "beard",
      "name": "Beard",
      "variant": "brown"
    },
    {
      "fileName": "hair/braid/male/dark_brown.png",
      "zPos": 120,
      "parentName": "hair",
      "name": "Braid",
      "variant": "dark brown"
    },
    {
      "fileName": "weapon/magic/crystal/blue.png",
      "zPos": 140,
      "parentName": "weapon_magic_crystal",
      "name": "Crystal",
      "variant": "blue"
    },
    {
      "fileName": "tools/rod/foreground/rod.png",
      "zPos": 150,
      "custom_animation": "tool_rod",
      "parentName": "weapon",
      "name": "Rod",
      "variant": "rod"
    },
    {
      "fileName": "weapon/magic/crystal/attack_thrust/blue.png",
      "zPos": 151,
      "custom_animation": "thrust_oversize",
      "parentName": "weapon_magic_crystal",
      "name": "Crystal",
      "variant": "blue"
    }
  ]
}
